{
  "id": "mnemonic-derivation-v1",
  "normativeSymbolSdk": "3.3.2-pure.2",
  "mnemonic": "vehicle unfold decline merry control genuine real already erase address unique clerk have rice motor spike human own attack trim gloom inch payment chronic",
  "passphrase": "",
  "accountId": 0,
  "cases": [
    {
      "chain": "symbol",
      "network": "mainnet",
      "privateKey": "B8821DDC1E7B35D20AE6DC35EC79F644EB7E6843A2CF977AD08DB31BDD1E0678",
      "publicKey": "F3EC8A5DAD8AF4566C0CF25C1B092F608D303728A8EAB14481E2824EC7967D05",
      "address": "ND6JFGH64RIDEQC3HQUEW2CIO7PGWRJD4KMTARQ"
    },
    {
      "chain": "nem",
      "network": "mainnet",
      "privateKey": "F532362ED9F59309EB1413027F1F742A07262C95B0257A97D3EF7FD95B51E77E",
      "publicKey": "7B80BE99D38ED9BB7B33C3FE1C3087683BDEADF49AB664A08BE4215A53CE06EB",
      "address": "NBRZWXOVWSKQNVWJNNI3H72WLKMFCLN33OFJPAEL"
    }
  ]
}
